{
  "schemaVersion": "evaluation-oracle.v1",
  "oracleId": "oracle:TS-CAP-003:r1",
  "scenarioId": "TS-CAP-003",
  "observations": [
    {
      "criterionId": "ts-cap-003.observation",
      "operator": "equals",
      "actualPath": "run.observations",
      "expected": {
        "speaker": "unknown",
        "identityConfidence": "low",
        "cropped": true
      }
    }
  ],
  "identity": {
    "criterionId": "ts-cap-003.identity",
    "decision": "abstain",
    "reviewRequired": true,
    "evidenceRefs": [
      "span-1"
    ]
  },
  "transitions": [],
  "terminal": {
    "criterionId": "ts-cap-003.terminal",
    "status": "clarify",
    "reasonCode": "identity_clues_insufficient"
  },
  "requiredQuestions": [
    "Which existing person and Pursuit, if any, does this source belong to?"
  ],
  "allowedEffects": [],
  "forbidden": [
    {
      "criterionId": "ts-cap-003.forbidden.1",
      "code": "automatic_identity_binding",
      "description": "Low-confidence cropped clues must not bind a Person.",
      "blocker": false
    },
    {
      "criterionId": "ts-cap-003.forbidden.2",
      "code": "candidate_state_write",
      "description": "No candidate fact may be persisted before identity review.",
      "blocker": false
    }
  ]
}
