{
  "schemaVersion": "evaluation-oracle.v1",
  "oracleId": "oracle:TS-MEM-002:r1",
  "scenarioId": "TS-MEM-002",
  "observations": [
    {
      "criterionId": "ts-mem-002.observation",
      "operator": "equals",
      "actualPath": "run.memoryComparison",
      "expected": {
        "existingFactRef": "fact-syn-002",
        "newSourceRef": "source-syn-mem-002b",
        "semanticRelation": "duplicate_evidence"
      }
    }
  ],
  "identity": {
    "criterionId": "ts-mem-002.identity",
    "decision": "not_applicable",
    "reviewRequired": false
  },
  "transitions": [
    {
      "criterionId": "ts-mem-002.transition.1",
      "operation": "append_evidence_lineage",
      "target": "fact-syn-002.evidenceRefs",
      "authority": "confirmed",
      "evidenceRefs": [
        "source-syn-mem-002b",
        "msg-2"
      ]
    }
  ],
  "terminal": {
    "criterionId": "ts-mem-002.terminal",
    "status": "proposal",
    "reasonCode": "lineage_extension_review"
  },
  "requiredQuestions": [],
  "allowedEffects": [],
  "forbidden": [
    {
      "criterionId": "ts-mem-002.forbidden.1",
      "code": "duplicate_active_state",
      "description": "Repeated evidence must not create a second active fact.",
      "blocker": false
    },
    {
      "criterionId": "ts-mem-002.forbidden.2",
      "code": "source_dropped",
      "description": "The new source lineage must remain inspectable.",
      "blocker": false
    }
  ],
  "proposal": {
    "criterionId": "ts-mem-002.proposal",
    "kind": "lineage_review",
    "maxCount": 1,
    "requiresHumanReview": true,
    "evidenceRefs": [
      "source-syn-mem-002b",
      "msg-2"
    ]
  }
}
